{"slug":"aws-quick-dlp-purview","observed_at":"2026-08-20T18:34:00+08:00","stage":"scan","source_urls":["https://aws.amazon.com/new/"],"points":["AWS What's New rendered the announcement: Amazon Quick now supports data loss prevention with Microsoft Purview.","G0/G4/G5 pass: administrators have a compliance-driven DLP integration task; G1/G2/G3 remain unrun."],"gates":{"G0":"pass","G4":"pass","G5":"pass"}}
