{"slug":"us-state-age-verification-compliance-checklist","observed_at":"2026-08-20T20:35:00+08:00","stage":"scan","source_urls":["https://news.ycombinator.com/newest?next=49373409&n=31","https://www.google.com/search?q=US%20state%20age%20verification%20compliance%20checklist","https://www.google.com/search?q=US%20state%20age%20verification%20compliance%20checklist&start=10"],"points":["HN current signal reports age-verification legislation activity across 21 U.S. states, supporting a current compliance task and stable user wording.","G1 passes because the query resolves to the intended multi-state compliance task rather than a different homonym or purely navigational intent.","G2 vetoes after full first and second result pages: both pages are densely filled by exact compliance calendars, bill trackers, state-law overviews, implementation guides, identity vendors and platform guidance; no quality cliff or missing exact-task layer appears."],"gates":{"G0":"pass","G4":"pass","G5":"pass","G1":"pass","G2":"veto"}}
