{"slug": "aws-iam-policy-autopilot-terraform-plan", "observed_at": "2026-08-21T11:10:00+08:00", "stage": "scan", "source_urls": ["https://www.google.com/search?q=%22IAM+Policy+Autopilot%22+Terraform+plan&gl=us&hl=en&pws=0", "https://www.google.com/search?q=generate+least+privilege+IAM+policy+from+terraform+plan+file&gl=us&hl=en&pws=0&num=20"], "points": ["G1:首屏无原生组件/featured snippet/AI Overview 完成任务;G1=pass。", "G2 完整首页阅读(宽措辞):结构最健康的一个——tinfoilcipher.co.uk、mhdez.com、aviator.co、OneUptime 等小站,Reddit r/Terraform 多帖、Stack Overflow 两条、GitHub issue,HashiCorp 官方教程仅占一位;G2=pass。", "G3(窄措辞):aws.amazon.com what's-new 首位、awslabs/iam-policy-autopilot GitHub 仓库次位(17 小时前更新)、DevelopersIO 已发完整走查(明写 terraform plan → terraform show -json 的转换步骤),官方+仓库+第三方走查三条已把任务做完。", "G3(宽措辞):同一底层任务另有 tinfoilcipher(2023-12)、mhdez.com 的 iamlive 方案、AWS IAM Access Analyzer 原生能力,均在本查询持续可见。", "两种措辞下免费实现都 ≥2 且持续可见,不属于'尚未收录'的临时空位 → G3=veto。"], "gates": {"G1": "pass", "G2": "pass", "G3": "veto"}}