{
  "slug": "vercel-compliance-documents",
  "observed_at": "2026-08-20T19:58:15+08:00",
  "stage": "track",
  "source_urls": [
    "https://www.google.com/search?q=Download%20Vercel%20compliance%20documents&gl=us&hl=en&pws=0&safe=active&ssui=on",
    "https://www.google.com/search?q=%22Download%20Vercel%20compliance%20documents%22&gl=us&hl=en&pws=0&safe=active&ssui=on",
    "https://vercel.com/changelog/compliance-documents-are-now-available-in-team-settings",
    "https://vercel.com/docs/security/compliance",
    "https://security.vercel.com/"
  ],
  "points": [
    "G0 零成本重核：由本组织授权的 Vercel 团队管理员获取 SOC 2 与安全政策等合规材料，是正常的采购、安全审计与治理任务；未见违法、违反 ToS、欺诈供血或规避工具信号。",
    "G1 真浏览器重跑翻转：无引号任务查询的 Google 首屏 AI Overview 已直接给出 Team Settings > Compliance、选择单份/多份/整套 attestation、下载水印 ZIP、Pro/Enterprise 限制及 Trust Center 备选入口，完整回答定位与下载流程，G1=veto。",
    "带引号精确查询本身无 AI Overview，只显示 Vercel changelog 与 changelog 索引；无引号自然任务查询生成完整 AI Overview，因此按用户实际搜索意图采用更严格的 G1 否决。",
    "SERP 实际条件：桌面 Chrome，URL 带 gl=us、hl=en、pws=0，页脚显示 Results are not personalized；但 Google 账号仍登录且自动加入 safe=active 与 ssui=on，未完全达到未登录条件。",
    "G2 复看：自然结果主要为 Vercel changelog、Security & Compliance 文档、Trust Center、安全页与相关内页；没有视频占屏、大媒体或品牌首页单项垄断，G2 保持 pass。",
    "G3 复看：changelog 说明 dashboard 下载路径；Trust Center 是同一厂商的请求/访问入口，Security & Compliance 页面主要说明合规框架。未发现两个独立免费页面完整执行受权限保护的团队下载任务，G3 保持 pass。",
    "官方叫法稳定为 Compliance section in Team settings、compliance documents 与 Trust Center；下载产物描述为带用户和团队信息水印的 single zip archive。外部尚未形成独立别名。",
    "形成信号仍由 Vercel 官方页面和 Google AI 摘要主导，没有独立来源采用；同时 AI Overview 已封闭操作型查询，足以触发 G1 否决。",
    "Semrush 未调用：G1 已达到硬否决线，任何关键词行都不会改变本次 tracking→rejected 决策。"
  ],
  "gates": {
    "G0": "pass",
    "G1": "veto",
    "G2": "pass",
    "G3": "pass"
  }
}
