{"slug": "aws-cost-anomaly-third-party-bedrock-models", "observed_at": "2026-08-21T10:30:00+08:00", "stage": "scan", "source_urls": ["https://www.google.com/search?q=AWS+Cost+Anomaly+Detection+third-party+models+Amazon+Bedrock&gl=us&hl=en&pws=0", "https://aws.amazon.com/new/"], "points": ["【修复说明】本文件是两次真实观察的并集,不是一次观察。原因:xinci-run 运行 run-20260821T024756Z-a2592003 在写本轮观察时复用了同日文件名 <日期>-scan.json,覆盖掉了同一路径上已存在的前一次观察;而账本里有两条 history 都以本文件为 evidence,各自提交了不同闸门。为使每条 history 的闸门都有真实观察支撑、同时不编造任何内容,此处把被覆盖的原件(自 git 提交 8db1743 取回 / 或本次会话内可复原的原文)与覆盖后的内容合并,两次观察的要点与 source_urls 均按原样保留并标注归属。", "—— 第一次观察(2026-08-21T10:30:00+08:00,补跑 G1)——", "G1 补跑:美区英文未登录、pws=0,只看首屏。", "首屏无 featured snippet、无原生计算/转换组件、无 knowledge panel、无把任务做完的 AI Overview;G1=pass。", "首屏由厂商 what's-new 与官方文档领衔,属 G2/G3 的问题,不构成 G1 否决。", "本轮深审配额已用于其他 8 个候选,本候选继续排队等下轮补 G2/G3。", "—— 第二次观察(2026-08-21T11:05:00+08:00,按陷阱类别四零成本判 G5)——", "本次实际打开 https://aws.amazon.com/new/：页面自述「AWS 的新功能 / 最新公告」，带 RSS 订阅、按发布日倒排（当前首页为 2026-08-17 批，共约 10000 条），确认本方向来源即厂商自家 what’s-new 变更公告 feed。", "本方向公告已不在当前首页 10 条内（该 feed 每日多条），本次确认的是来源 feed 的身份而非逐条重看公告；方向的公告出处与任务记录已在账本。", "任务性质核对：本方向任务为「Configure a third-party Bedrock model for AWS Cost Anomaly Detection.」，即「怎么用 / 怎么配这个新功能」，与陷阱类别四识别特征一致；不属于该类别列明的例外（第三方跨厂商横向汇总 / 对比 / 迁移）。", "G5 判定：命中陷阱类别四「厂商 release note / changelog 衍生任务」（SERP 陷阱型·直接筛除型）。该类别已于 2026-08-21 按跨 3 日期 / 3 来源家族 / 3 独立发布方（Apple、GitHub、AWS）的独立性依据改标为直接筛除型，处置为零成本弃、一次 SERP 都不跑，故本次未跑 G2/G3；G5=veto。"], "gates": {"G1": "pass", "G5": "veto"}}