{"slug":"gcp-migrate-google-cloud-batch-debian-11-jobs-to-debian-12","observed_at":"2026-08-20T19:20:00+08:00","stage":"scan","source_urls":["https://docs.cloud.google.com/release-notes?hl=en","https://www.google.com/search?q=Migrate%20Google%20Cloud%20Batch%20Debian%2011%20jobs%20to%20Debian%2012&gl=us&hl=en&pws=0","https://www.google.com/search?q=Migrate%20Google%20Cloud%20Batch%20Debian%2011%20jobs%20to%20Debian%2012&gl=us&hl=en&pws=0&start=10"],"points":["Google Cloud release notes dated August 19, 2026 require Batch Debian 11 image users to migrate before August 31 and explain automatic versus explicit image-family handling.","G1 first screen had no Google native component or AI Overview completing the migration.","G2 read both pages: exact Batch migration has only the Google release note; remaining results are generic Debian/GCP migration pages and quality declines on page two.","G3 pass: only the release note completes the exact Google Cloud Batch image-family task; generic Debian upgrade pages do not handle Batch job definitions, so fewer than two stable exact-task implementations exist."],"gates":{"G0":"pass","G4":"pass","G5":"pass","G1":"pass","G2":"pass","G3":"pass"}}
