{"slug":"aws-sagemaker-data-profiling","observed_at":"2026-08-20T18:34:00+08:00","stage":"scan","source_urls":["https://aws.amazon.com/new/"],"points":["AWS What's New rendered the announcement: Amazon SageMaker Unified Studio now supports data profiling and anomaly detection.","G0/G4/G5 pass: data teams have repeated profiling and anomaly-detection setup tasks; G1/G2/G3 remain unrun."],"gates":{"G0":"pass","G4":"pass","G5":"pass"}}
