{"slug":"cf-tunnel-connectivity-prechecks","observed_at":"2026-08-20T17:07:51+08:00","stage":"scan","source_urls":["https://developers.cloudflare.com/changelog/rss/index.xml","https://www.google.com/search?q=Cloudflare%20Tunnel%20now%20runs%20connectivity%20pre-checks%20at%20startup&gl=us&hl=en&pws=0","https://www.google.com/search?q=Cloudflare%20Tunnel%20now%20runs%20connectivity%20pre-checks%20at%20startup&gl=us&hl=en&pws=0&start=10","https://developers.cloudflare.com/changelog/post/2026-05-27-cloudflared-connectivity-prechecks/","https://developers.cloudflare.com/cloudflare-one/networks/connectors/cloudflare-tunnel/troubleshoot-tunnels/connectivity-prechecks/"],"points":["G1 未见 Google 原生连接测试工具直接完成任务。","G2 两页有官方文档、小站、社区、Reddit、GitHub 与 Medium，结构可继续核验。","G3 实测 cloudflared 内置启动预检与 Cloudflare 免费 connectivity-prechecks 指南都能完成 DNS、7844 端口和 API 连通性诊断，两项在本查询第一页稳定可见，达到否决线。"],"gates":{"G0":"pass","G4":"pass","G5":"pass","G1":"pass","G2":"pass","G3":"veto"}}
