{"slug":"aws-secrets-manager-jenkins-sonarqube","observed_at":"2026-08-20T21:24:00+08:00","stage":"scan","source_urls":["https://aws.amazon.com/about-aws/whats-new/recent/feed/","https://aws.amazon.com/about-aws/whats-new/2026/08/secrets-manager-integration-jenkins-sonarqube/","https://www.google.com/search?q=AWS%20Secrets%20Manager%20managed%20external%20secrets%20Jenkins%20SonarQube&gl=us&hl=en&pws=0&safe=active&ssui=on"],"points":["AWS RSS 2026-08-11 给出 Jenkins 与 SonarQube managed external secrets 新集成。","G0/G4/G5 通过：合法、可在线完成，且存在持续凭据轮换任务。","G1 首屏无 Google 原生组件、AI Overview 或 CAPTCHA；本轮新扫描深审配额已满，保留 captured 待下一轮补 G2/G3。","排队 expiry=2026-08-27；若官方集成撤回、搜索结构被两个以上独立完整实施指南占满或任务由平台自动完成，则无需继续深审。"],"gates":{"G0":"pass","G4":"pass","G5":"pass","G1":"pass"}}
