{"slug": "bis-critical-minerals-export-restriction", "observed_at": "2026-08-21T12:55:00+08:00", "stage": "scan", "source_urls": ["https://www.federalregister.gov/api/v1/documents.json?conditions%5Bpublication_date%5D%5Bgte%5D=2026-08-03&conditions%5Btype%5D%5B%5D=RULE&conditions%5Btype%5D%5B%5D=PRORULE", "https://www.federalregister.gov/documents/2026/08/06/2026-16078/dpas-directive-allocation-order-and-additional-requirements-for-recoverable-critical-minerals-and", "https://www.google.com/search?q=dpas+directive+allocation+order+recoverable+critical+minerals&gl=us&hl=en&pws=0"], "points": ["【修复说明】本文件是两次真实观察的并集,不是一次观察。原因:xinci-run 运行 run-20260821T024756Z-a2592003 第 3 轮补跑 G1 时复用了第 2 轮已写入的同日文件名 <日期>-scan.json,覆盖掉了第 2 轮那次记录 G0/G4/G5 的观察;而账本里 register(history[0])与 rejected(history[1])两条都以本文件为 evidence。为使两条 history 的闸门都有真实观察支撑、同时不编造任何内容,此处把两次观察合并,要点与 source_urls 按原样保留并标注归属。", "—— 第一次观察(第 2 轮,排队位注册,G0/G4/G5)——", "来源:Federal Register 2026-08-06 Rule:DPAS Directive Allocation Order and Additional Requirements for Recoverable Critical Minerals and Materials;URL:https://www.federalregister.gov/documents/2026/08/06/2026-16078/dpas-directive-allocation-order-and-additional-requirements-for-recoverable-critical-minerals-and。由第 2 轮从 Federal Register 规则全量列表接口批量提取(变化面允许结构化采集)。", "G0 pass:任务本身合法,不违反平台条款,市场不由欺诈供血,亦非规避检测工具。", "G4 pass:搜索者要完成的是查条件、算金额、走流程一类可完全在线完成的事,不需要实地检查、物理采样或持照人员到场。", "G5 pass:第 2 轮判定未命中已成册陷阱类别(非类别四厂商 changelog、非类别二品牌名、非类别五信号面观点);是否落入类别三或类别六当时尚未实测,留待补门。", "G1/G2/G3 第 2 轮未跑:该轮 G1 名额优先给了 10 个更可能存在空位的方向,本条超出名额,按排队位入库,expiry 2026-09-11。", "—— 第二次观察(第 3 轮,还债补跑 G1 后判 G3)——", "本轮还债:该候选上轮以排队位入库(G0/G4/G5=pass),本轮先补 G1。命中陷阱类别三:付费者(黑粉/可回收关键矿物卖方与电池回收商)明确且有预算,行业协会、律所与行业厂商已占位。", "G1:首屏无 featured snippet、无原生组件、无 AI Overview;首位是 Federal Register。G1=pass。", "G3 数到的免费实现:Automotive Recyclers Association 的会员通告(2026-08-11,直接给出可执行事实『黑粉卖方须自 2026-08-27 起把 100% 月度销量分配给美国买方』)、Bergeson & Campbell(2026-08-10)、Holland & Knight(6 天前,给出同一日期与百分比)、Green Li-ion 的行业解读(2026-07-30,早于规则发布)、DCMA 官方 DPAS 页(全集说明)、Federal Register。", "行业协会是这类方向的天然占位者:它按会员义务发布,收录快且权威,第三方信息站没有位置。G3=veto。", "G2 未跑完(只读第 1 页,未翻第 2 页):本方向命中已成册的验证型陷阱类别,按闸门契约 G5 的验证型处置「跳过结构阅读直接跑 G3 验证」;且 G3 的否决线在第一页即已满足,翻第 2 页只会增加竞品、不可能移除已数到的实现,故 gates 不写 G2。"], "gates": {"G0": "pass", "G4": "pass", "G5": "pass", "G1": "pass", "G3": "veto"}}