{"slug":"aws-bedrock-web-search-filtering","observed_at":"2026-08-20T18:34:00+08:00","stage":"scan","source_urls":["https://aws.amazon.com/new/"],"points":["AWS What's New rendered a dated 2026-08-19 announcement: Web Search in Amazon Bedrock AgentCore adds domain and published date filtering.","G0/G4/G5 pass: developers have a repeatable task to constrain search by domain and publication date; G1/G2/G3 remain unrun due to Google unusual-traffic blocking."],"gates":{"G0":"pass","G4":"pass","G5":"pass"}}
