{"slug": "vercel-kms-jwt-signing", "observed_at": "2026-08-21T11:20:00+08:00", "stage": "track", "source_urls": ["https://www.google.com/search?q=Vercel+Functions+sign+JWT+without+private+key&gl=us&hl=en&pws=0", "https://www.google.com/search?q=Vercel+Functions+sign+JWT+without+private+key&gl=us&hl=en&pws=0&start=10"], "points": ["本次 SERP 条件比上次更接近契约要求：未登录浏览器，URL 带 gl=us&hl=en&pws=0，未被追加 safe=active/ssui=on（上次观察记录过登录态污染）。", "G0 零成本重核：用平台托管的非对称密钥在自己的 Function 里签发 JWT、再用公开 JWKS 验证，是常规应用鉴权任务；未见违法、违反 ToS、欺诈供血或规避检测信号，G0 保持 pass。", "G1 重跑：首屏无 featured snippet 完成任务、无原生组件、无 knowledge panel、未出现 AI Overview；首位是 Vercel changelog 公告本身。G1=pass。", "G2 读满两页：第 1 页为 Vercel changelog（首位）、daily.dev 转述、Curity 的 Vercel serverless JWT 验证代码示例、Vercel KMS Quickstart 官方文档，第 5 位起断层为 GitHub middleware discussion、LinkedIn 概念帖、Reddit r/nextjs NextAuth 故障、Facebook cookie 问题、Vercel「Sign in with Vercel」Tokens 文档；第 2 页整页泛 JWT/私钥内容（Stack Overflow、WorkOS、Auth0 Community、OAuth.net、Medium、DEV、Miguel Grinberg），无一涉及 Vercel KMS。未见视频占屏、维基/大媒体霸榜或强品牌首页垄断，G2=pass。", "G3 按「做什么」重数：完成精确任务（在 Vercel Function 内用托管密钥签 JWT 并对 JWKS 验证）的免费实现仍只有 Vercel 官方 KMS Quickstart 一个，其摘要即写明四步、无私钥；Curity 示例是自管密钥的 OAuth 验证场景、非同一任务，daily.dev 与 changelog 属公告转述，第 2 页无任何 Vercel KMS 实现。1 个 < 否决线 2 个，G3=pass。", "失效条件核对：两条均未命中——「前两页出现至少两个独立可运行的 Vercel KMS JWT 完整教程」实测两页仅官方 1 个；「Google 原生结果直接完成签名代码生成」未出现。expiry 2026-09-10 尚余 20 天。", "命名仍由官方主导：官方措辞为 Sign JWTs from your Functions without managing private keys / Vercel KMS；daily.dev 复述为 sign JWTs and raw messages using managed asymmetric keys (RSA, ECDSA, EdDSA)。未出现社区自发的独立叫法，aliases 无胜出者。", "形成信号不足：可见的两条（官方公告 + daily.dev 转述）均标注 3 days ago，仍是单点发布加一次转述，无独立第三方教程、无社区讨论增量。", "本次为该候选首份 -track 观察，形成确认的 7 天跨度自今日起算（最早 2026-08-28 可达）。Semrush 计费查询 0 次：跨度闸使本轮无论如何只能继续追踪，付费词行改变不了这个提议。"], "gates": {"G0": "pass", "G1": "pass", "G2": "pass", "G3": "pass"}}