{
  "slug": "gcp-restore-soft-delete-cloud-storage-buckets-after-project-de",
  "observed_at": "2026-08-23T11:25:58+00:00",
  "stage": "track",
  "source_urls": [
    "https://docs.cloud.google.com/release-notes?hl=en"
  ],
  "points": [
    "【性质】本次是 2026-08-23 闸门修订(G6 两条盈利线 + 强制深审入口预检)之后的重算,不是新的现场观察;下述判定全部零成本,不依赖任何新取的量级数据。",
    "【任务原文】Restore soft-delete Cloud Storage buckets after project deletion",
    "【订阅线】深审入口预检问「这个任务是否要求有预算的付费者逐个对象重复完成?」——答否。该任务是一次性读一遍厂商自家功能的配置/迁移/升级说明:对象是单一厂商功能而非可枚举的对象全集,动作做完即结束而非按对象重复,且厂商本身已免费提供该说明文档。没有可售之物,受约束付费者数量为 0,受约束付费者数 × 可行单价 = 0。订阅线不成立。",
    "【广告线】本候选 lane=new。按 G6 的赛道推论,新词道在结构上无法证明广告线成立——广告线要求可测量的簇内月搜索量,而「查无」正是新词道的定义属性。即便退一步估算:开发者垂类 RPM 处于最低一档,而目标 $200/月在该 RPM 下需要的簇内月搜索量达数十万级,单个厂商 release note 派生的长尾任务相差若干个数量级。广告线不成立。",
    "【结论】两条盈利线都不过 → G6=veto,走生命周期契约 rejected 边第⑦种情形。",
    "【与此前 G3=pass 的关系】此前该候选在 G3(占位竞争)上确实是 pass——首页没有专做这件事的站。这正是本次修订要修掉的漏洞:G3 只问「有没有人占了位」,不问「占了位能不能挣钱」。G6 此前不是筛选闸门,于是「没人占位」被当成了利好,而真实原因是这一格里没有钱,所以没人来。"
  ],
  "gates": {
    "G6": "veto"
  }
}