{"slug":"gh-secret-scanning-patterns-api","observed_at":"2026-08-20T19:02:00+08:00","stage":"scan","source_urls":["https://github.blog/changelog/2026-07-13-create-and-manage-secret-scanning-custom-patterns-via-rest-api","https://www.google.com/search?q=GitHub%20secret%20scanning%20custom%20patterns%20REST%20API&gl=us&hl=en&pws=0","https://www.google.com/search?q=GitHub%20secret%20scanning%20custom%20patterns%20REST%20API&gl=us&hl=en&pws=0&start=10","https://docs.github.com/en/rest/secret-scanning/custom-patterns","https://github.com/advanced-security/secret-scanning-custom-patterns"],"points":["GitHub Changelog confirms CRUD endpoints at repository, organization and enterprise levels.","G2 read both pages: official endpoint/reference pages dominate page one; page two adds a detailed as-code guide, GitHub's public example repository, videos, push-protection endpoints and community discussions.","G3 veto: GitHub REST Docs provides complete parameters, permissions and executable request samples; the public advanced-security repository provides 591 commits of free custom-pattern examples. Both persistently visible resources complete implementation work."],"gates":{"G0":"pass","G4":"pass","G5":"pass","G1":"pass","G2":"pass","G3":"veto"}}
